{
  "$schema": "https://json-schema.org/draft/2020-12/schema",
  "$id": "https://devbox.zenit-hosting.de/schema/template.v1.json",
  "title": "DevBox project template",
  "description": "template.json in each folder of a templates repository; used by the templates plugin to create new projects.",
  "type": "object",
  "required": ["id", "name"],
  "additionalProperties": false,
  "properties": {
    "$schema": {
      "type": "string",
      "description": "URL of this JSON Schema, for editor completion."
    },
    "$comment": {
      "type": "string",
      "description": "Free-form comment, ignored by DevBox."
    },
    "id": {
      "$ref": "#/$defs/id",
      "description": "Template ID, unique within its repository."
    },
    "name": {
      "$ref": "#/$defs/text",
      "description": "Display name of the template."
    },
    "description": {
      "$ref": "#/$defs/text",
      "description": "Short description shown in the template list."
    },
    "language": {
      "type": "string",
      "pattern": "^[a-z][a-z0-9-]*$",
      "description": "Main language or platform, e.g. node, java, dotnet, python or other; used for grouping and filtering."
    },
    "tags": {
      "type": "array",
      "description": "Free tags for search.",
      "items": {
        "type": "string",
        "minLength": 1,
        "description": "Tag."
      }
    },
    "params": {
      "type": "object",
      "description": "Parameters by key; their values replace {{key}} placeholders in rendered files.",
      "propertyNames": {
        "$ref": "#/$defs/key"
      },
      "additionalProperties": {
        "$ref": "#/$defs/field"
      }
    },
    "files": {
      "type": "object",
      "description": "Which files of the template folder are copied and rendered. template.json itself is never copied.",
      "additionalProperties": false,
      "properties": {
        "include": {
          "type": "array",
          "description": "Files to copy; missing means all files.",
          "items": {
            "type": "string",
            "minLength": 1,
            "description": "Glob relative to the template folder."
          }
        },
        "exclude": {
          "type": "array",
          "description": "Files not to copy, applied after include.",
          "items": {
            "type": "string",
            "minLength": 1,
            "description": "Glob relative to the template folder."
          }
        },
        "render": {
          "type": "array",
          "description": "Copied files in which {{key}} placeholders are replaced by parameter values; all others are copied unchanged.",
          "items": {
            "type": "string",
            "minLength": 1,
            "description": "Glob relative to the template folder."
          }
        }
      }
    },
    "hooks": {
      "type": "object",
      "description": "Commands run in the new project folder.",
      "additionalProperties": false,
      "properties": {
        "postCreate": {
          "type": "array",
          "description": "Commands run in order after the files were created.",
          "items": {
            "type": "array",
            "minItems": 1,
            "description": "Command as an exec-style array, no shell string.",
            "items": {
              "type": "string",
              "description": "Program or argument."
            }
          }
        }
      }
    },
    "requires": {
      "type": "object",
      "description": "What must be present before the template can be used.",
      "additionalProperties": false,
      "properties": {
        "commands": {
          "type": "array",
          "description": "Commands that must be found in PATH.",
          "items": {
            "type": "string",
            "minLength": 1,
            "description": "Command name."
          }
        },
        "plugins": {
          "type": "object",
          "description": "Plugins by ID with the version range each must satisfy.",
          "propertyNames": {
            "$ref": "#/$defs/id"
          },
          "additionalProperties": {
            "type": "string",
            "description": "Version range of the required plugin."
          }
        }
      }
    }
  },
  "$defs": {
    "id": {
      "type": "string",
      "pattern": "^[a-z][a-z0-9-]{1,31}$"
    },
    "key": {
      "type": "string",
      "pattern": "^[a-z][A-Za-z0-9]{0,47}$"
    },
    "text": {
      "type": "string",
      "minLength": 1,
      "maxLength": 500
    },
    "field": {
      "description": "Form field: a JSON Schema fragment for a setting, parameter, credential field or consumer option. Same closed keyword list as subschema, but label is required.",
      "type": "object",
      "$ref": "#/$defs/subschema",
      "required": ["type", "label"]
    },
    "subschema": {
      "type": "object",
      "description": "Closed list of JSON Schema keywords supported by SchemaForm. Used directly for nested values (array items, object properties), where label and help are optional.",
      "required": ["type"],
      "additionalProperties": false,
      "properties": {
        "type": {
          "enum": ["string", "integer", "number", "boolean", "array", "object"],
          "description": "JSON type of the value."
        },
        "label": {
          "$ref": "#/$defs/text",
          "description": "Label of the form field."
        },
        "help": {
          "$ref": "#/$defs/text",
          "description": "Help text of the form field."
        },
        "default": {
          "description": "Default value. Not type-checked, because placeholders such as ${java.defaultVersion} are resolved before type checking."
        },
        "advanced": {
          "type": "boolean",
          "description": "Collapse the field under further options."
        },
        "secret": {
          "type": "boolean",
          "description": "Render as password field; never prefilled."
        },
        "optionsFrom": {
          "type": "string",
          "pattern": "^[a-z][a-z0-9-]{1,31}\\.[a-z][A-Za-z0-9]{0,47}#(/[^/]*)*$",
          "description": "Fills a selection from check data: <plugin>.<check>#<JSON Pointer>, with * for list items."
        },
        "enum": {
          "type": "array",
          "minItems": 1,
          "description": "Allowed values."
        },
        "const": {
          "description": "The only allowed value."
        },
        "format": {
          "enum": ["uri", "date-time", "path"],
          "description": "String format; path shows a placeholder preview."
        },
        "pattern": {
          "type": "string",
          "description": "Regular expression (RE2 and ECMAScript compatible) a string must match."
        },
        "minimum": {
          "type": "number",
          "description": "Inclusive lower bound."
        },
        "maximum": {
          "type": "number",
          "description": "Inclusive upper bound."
        },
        "exclusiveMinimum": {
          "type": "number",
          "description": "Exclusive lower bound."
        },
        "exclusiveMaximum": {
          "type": "number",
          "description": "Exclusive upper bound."
        },
        "minLength": {
          "type": "integer",
          "minimum": 0,
          "description": "Minimum string length."
        },
        "maxLength": {
          "type": "integer",
          "minimum": 0,
          "description": "Maximum string length."
        },
        "items": {
          "$ref": "#/$defs/subschema",
          "description": "Schema of the array items."
        },
        "minItems": {
          "type": "integer",
          "minimum": 0,
          "description": "Minimum number of array items."
        },
        "maxItems": {
          "type": "integer",
          "minimum": 0,
          "description": "Maximum number of array items."
        },
        "uniqueItems": {
          "type": "boolean",
          "description": "Whether array items must be unique."
        },
        "properties": {
          "type": "object",
          "additionalProperties": {
            "$ref": "#/$defs/subschema"
          },
          "description": "Schemas of the object properties."
        },
        "required": {
          "type": "array",
          "items": {
            "type": "string"
          },
          "uniqueItems": true,
          "description": "Object properties that must be present."
        },
        "additionalProperties": {
          "oneOf": [
            {
              "type": "boolean"
            },
            {
              "$ref": "#/$defs/subschema"
            }
          ],
          "description": "Whether, or with which schema, further object properties are allowed."
        },
        "examples": {
          "type": "array",
          "description": "Example values shown as hints."
        }
      }
    }
  }
}
